work_order_id;equipment_id;equipment_type;fabricante;modelo;prioridade;tipo_manutencao;status;data_abertura;data_inicio;data_fim;tempo_reparo_min;causa_raiz;componente_afetado;severidade_falha;tempo_parada_h;horas_planejadas_em_aberto;equipe_capacidade_h_dia;tempo_disponivel_h;tempo_operado_h;local;turno;custo_estimado;responsavel;observacoes
WO0188;H004;Colhedora de cana;Valtra;Val-228;Média;Preventiva;Concluída;2024-06-13 17:11;2024-06-14 03:00;2024-06-16 18:45;3825;Manutenção programada;Motor;3;3,7;35,7;10;14,1;10,4;Armazém;Tarde;8304;Gabrielly Costela;
WO0189;H008;Colhedora de cana;Valtra;Val-318;Alta;Corretiva;Concluída;2023-03-27 03:27;2023-03-28 06:25;2023-03-30 00:03;2498;Erro humano;Transmissão;5;18,4;7,7;10;19,4;1;Fazenda B;Manhã;29347;Marina Montenegro;"Ea nemo iusto est repudiandae esse dolorem asperiores.
Eos vel itaque laborum hic hic. Animi soluta possimus cumque asperiores sit harum."
WO0190;T003;Trator;AGCO;AGC-T75;Baixa;Corretiva;Em Andamento;2026-02-24 11:09;2026-02-24 13:54;;1946;Erro humano;Transmissão;1;10,4;44;6;12,6;2,2;Fazenda B;Noite;2167;Srta. Ana Lívia Aragão;"Itaque debitis accusantium tempora. Rem placeat iusto perferendis laudantium. Mollitia ipsum reiciendis illum illo.
Perferendis rerum temporibus vero reiciendis sapiente."
WO0191;T010;Trator;Case IH;Cas-T77;Baixa;Preditiva;Concluída;2025-04-21 16:25;2025-04-22 02:06;2025-04-24 10:33;3387;Sobrecarga;Sistema hidráulico;1;9,9;37,3;7;12,2;2,3;Fazenda A;Tarde;6352;Evelyn Mendonça;"Mollitia modi cum. Explicabo culpa non velit.
Aliquam rem consectetur numquam maiores enim consectetur. Nobis blanditiis veniam quam rem adipisci. Aut consequatur mollitia possimus."
WO0192;T012;Trator;John Deere;Joh-T122;Baixa;Preventiva;Concluída;2024-04-14 18:18;2024-04-14 23:26;2024-04-15 07:55;509;Manutenção programada;Sistema hidráulico;1;11,6;11,5;10;19,4;7,8;Fazenda B;Tarde;3663;Dante Viana;
WO0193;H008;Colhedora de cana;Valtra;Val-318;Alta;Corretiva;Em Andamento;2026-02-22 01:56;2026-02-23 01:10;;1402;Desgaste de peças;Transmissão;4;0,3;3,7;11;10,2;9,9;Armazém;Noite;18708;Sofia Fogaça;Pariatur optio quos similique fuga. Unde maxime dolores maxime ex rerum reiciendis. Voluptate dolore rerum delectus voluptatum sint dolorum.
WO0194;H008;Colhedora de cana;Valtra;Val-318;Média;Preventiva;Em Andamento;2026-02-12 06:01;2026-02-12 15:42;;881;Manutenção programada;Sistema elétrico;2;9,2;24,8;6;10,8;1,6;Fazenda B;Tarde;2150;Sr. Antony Novaes;Nostrum consequuntur odio praesentium vero. Vel eveniet magni voluptatem excepturi tenetur aliquid.
WO0195;T012;Trator;John Deere;Joh-T122;Alta;Corretiva;Concluída;2024-08-09 17:10;2024-08-11 04:23;2024-08-11 12:13;470;Erro humano;Transmissão;5;11;29,6;13;12,2;1,2;Armazém;Tarde;40523;Ayla da Mota;
WO0196;H009;Colhedora de cana;Valtra;Val-288;Alta;Corretiva;Em Andamento;2026-02-05 06:32;2026-02-05 15:05;;1241;Condições ambientais;Pneus/Rodas;5;4,6;1,4;10;13,1;8,5;Fazenda A;Manhã;45510;Maria Luiza Camargo;
WO0197;H011;Colhedora de cana;Valtra;Val-331;Alta;Corretiva;Em Andamento;2026-01-30 15:45;2026-01-30 17:15;;3628;Desgaste de peças;Ferramentas de corte;5;8;7,9;14;8,4;0,4;Fazenda B;Manhã;32601;Hadassa Lopes;"Facilis tempore enim totam laudantium. Omnis placeat quia beatae. Perferendis quasi fuga molestiae ratione velit occaecati.
Praesentium quam dolore molestiae mollitia ex. Saepe quaerat aliquam rerum."
WO0198;H012;Colhedora de cana;Case IH;Cas-275;Média;Preditiva;Aberta;2023-08-12 03:21;;;2386;Condições ambientais;Sistema elétrico;3;6,2;16,4;13;9,2;3;Armazém;Tarde;24577;Srta. Eloah Pimenta;
WO0199;H006;Colhedora de cana;Valtra;Val-290;Média;Preditiva;Em Andamento;2026-02-20 13:36;2026-02-21 12:37;;4496;Falha mecânica;Sistema elétrico;2;4,3;34,4;15;21,8;17,5;Fazenda A;Noite;8248;Cauã Gonçalves;
WO0200;H002;Colhedora de cana;New Holland;New-267;Baixa;Preditiva;Concluída;2023-03-13 08:41;2023-03-15 04:37;2023-03-16 22:52;2535;Erro humano;Sistema hidráulico;1;5,3;3,7;13;16,6;11,3;Fazenda B;Noite;9060;Vitor Hugo Câmara;
WO0201;T004;Trator;Valtra;Val-T81;Baixa;Preditiva;Aberta;2023-09-08 06:18;;;1337;Erro humano;Pneus/Rodas;1;6,1;6,3;6;13,4;7,3;Fazenda B;Manhã;6627;Dr. Daniel Castro;"Veritatis architecto explicabo placeat saepe hic ea id. Atque earum ab beatae.
Reiciendis dolore a harum facere esse. Nulla expedita dicta totam. At quos ex velit illo soluta."
WO0202;H007;Colhedora de cana;John Deere;Joh-358;Baixa;Preditiva;Aberta;2024-11-06 21:04;;;2744;Desgaste de peças;Transmissão;1;5,8;1,5;11;20,3;14,5;Armazém;Manhã;7072;Rebeca Nunes;"Ipsam necessitatibus dolorem nam.
Quas libero quaerat saepe vero harum.
Voluptates fuga alias dolorum non minima distinctio. Quis dolore dolorum ipsam error facere autem."
WO0203;T001;Trator;New Holland;New-T163;Média;Preditiva;Aberta;2026-01-08 06:47;;;9634;Condições ambientais;Pneus/Rodas;2;7,5;10,6;14;20;12,5;Fazenda B;Manhã;12955;Cauê Azevedo;Dolor officiis distinctio dolore dicta inventore atque. Illo ducimus corporis temporibus dolores voluptatem omnis. Cumque explicabo earum.
WO0204;T008;Trator;Case IH;Cas-T163;Média;Preventiva;Em Andamento;2026-02-13 13:54;2026-02-14 05:14;;1840;Manutenção programada;Motor;3;16,7;29,5;14;21,7;5;Fazenda B;Manhã;16415;Apollo Rios;At tempore animi cupiditate temporibus. Maiores voluptas cumque exercitationem culpa dolorum.
WO0205;H005;Colhedora de cana;Case IH;Cas-206;Média;Preditiva;Concluída;2023-08-24 02:23;2023-08-25 19:16;2023-08-30 15:45;6989;Desgaste de peças;Sistema elétrico;3;9;36,8;10;10,3;1,3;Armazém;Tarde;20818;Olivia Fonseca;
WO0206;H004;Colhedora de cana;Valtra;Val-228;Média;Corretiva;Em Andamento;2026-02-19 08:43;2026-02-19 12:31;;4872;Condições ambientais;Transmissão;2;12,3;33,8;6;15,4;3,1;Armazém;Noite;11008;Lorenzo Farias;Nostrum reprehenderit esse magni laborum aperiam. Iste fuga aliquid qui blanditiis rerum atque qui. Molestias soluta eveniet nemo libero suscipit.
WO0207;T003;Trator;AGCO;AGC-T75;Média;Preditiva;Concluída;2025-07-01 07:22;2025-07-01 10:57;2025-07-03 16:29;3212;Falha mecânica;Pneus/Rodas;3;3,4;10,3;14;15,1;11,7;Fazenda B;Noite;10301;Otávio Aragão;
WO0208;H005;Colhedora de cana;Case IH;Cas-206;Baixa;Preditiva;Concluída;2024-04-11 21:31;2024-04-13 07:45;2024-04-15 01:32;2507;Falha mecânica;Pneus/Rodas;1;4,8;32,5;14;12,8;8;Fazenda A;Noite;5767;Dr. Luiz Felipe da Conceição;"Aut ratione eum molestias. Laboriosam tempore at earum nisi nisi eos. Mollitia facilis optio adipisci tenetur.
Odio praesentium odio impedit. Unde quas vel."
WO0209;H008;Colhedora de cana;Valtra;Val-318;Média;Preventiva;Aberta;2023-04-02 12:54;;;4054;Manutenção programada;Ferramentas de corte;2;15,9;22,2;9;19,4;3,5;Armazém;Manhã;11438;Yuri Pacheco;
WO0210;T002;Trator;Case IH;Cas-T79;Média;Preventiva;Em Andamento;2026-01-25 15:45;2026-01-25 23:25;;5805;Manutenção programada;Transmissão;3;8,9;17,1;15;9;0,1;Fazenda A;Tarde;16488;Dra. Daniela Dias;Eius ducimus veniam voluptatem iste nulla ullam. Molestias expedita animi sapiente quod.
WO0211;T008;Trator;Case IH;Cas-T163;Baixa;Corretiva;Em Andamento;2026-02-07 17:37;2026-02-08 14:56;;3413;Falha mecânica;Pneus/Rodas;1;12,2;29,6;9;21,8;9,6;Fazenda B;Tarde;3445;Clarice Rodrigues;
WO0212;T002;Trator;Case IH;Cas-T79;Média;Preventiva;Aberta;2023-02-16 16:40;;;2437;Manutenção programada;Sistema elétrico;2;6,9;17,7;16;10,3;3,4;Armazém;Noite;2617;Lorenzo Costela;Molestias inventore ipsam sequi saepe quam exercitationem. Deleniti consectetur in nihil ullam. Ducimus perspiciatis doloribus doloribus.
WO0213;H002;Colhedora de cana;New Holland;New-267;Média;Preventiva;Aberta;2025-09-29 03:14;;;2636;Manutenção programada;Transmissão;3;6,4;2,1;14;21,3;14,9;Armazém;Manhã;25002;Henrique Cassiano;
WO0214;T012;Trator;John Deere;Joh-T122;Média;Corretiva;Aberta;2024-03-16 10:42;;;9171;Condições ambientais;Sistema elétrico;3;14,5;10;10;19,9;5,4;Fazenda A;Tarde;29660;Dra. Mariane Duarte;
WO0215;T008;Trator;Case IH;Cas-T163;Baixa;Corretiva;Concluída;2025-06-07 05:17;2025-06-07 22:13;2025-06-08 07:06;533;Desgaste de peças;Transmissão;1;0,3;40,2;12;22,3;22;Fazenda B;Tarde;6851;Srta. Esther Fogaça;
WO0216;T007;Trator;John Deere;Joh-T165;Média;Preventiva;Em Andamento;2026-02-06 06:35;2026-02-07 02:14;;2862;Manutenção programada;Sistema elétrico;3;9,1;19,1;12;12,8;3,7;Armazém;Tarde;11665;Sra. Sofia Gomes;Explicabo perferendis accusamus asperiores. Repellendus sapiente fugit quis sequi eos esse aliquam.
WO0217;H008;Colhedora de cana;Valtra;Val-318;Média;Preventiva;Em Andamento;2026-01-26 12:33;2026-01-26 17:32;;2622;Manutenção programada;Ferramentas de corte;2;12,3;35,6;15;19,9;7,6;Fazenda B;Noite;7675;Helena Almeida;"Molestias deserunt provident et.
Quod aut vel tempore qui sed est. Tempora laboriosam possimus animi officiis recusandae."
WO0218;H006;Colhedora de cana;Valtra;Val-290;Alta;Preditiva;Em Andamento;2026-02-13 09:42;2026-02-14 08:24;;2168;Sobrecarga;Pneus/Rodas;4;9,8;1,7;14;22,2;12,4;Armazém;Tarde;5083;Benjamin Caldeira;
WO0219;T015;Trator;Case IH;Cas-T200;Alta;Corretiva;Aberta;2023-04-29 12:05;;;8608;Condições ambientais;Transmissão;5;6,7;37,9;15;14,5;7,8;Fazenda A;Noite;26164;Luiz Henrique Andrade;"Ea quod reprehenderit neque quaerat perferendis. Quidem cum quaerat inventore qui omnis quasi sapiente.
Molestias aspernatur ipsum consequuntur consequuntur. Neque rem esse magni voluptate."
WO0220;T009;Trator;Case IH;Cas-T173;Média;Preventiva;Concluída;2023-04-28 20:41;2023-04-29 03:52;2023-04-30 21:30;2498;Manutenção programada;Ferramentas de corte;3;13,7;42,3;11;17,3;3,6;Armazém;Noite;6444;Otto Brito;"Eos vero tempora. Quod inventore possimus laudantium ex.
Unde est excepturi ad. Iure quidem dignissimos.
Laboriosam blanditiis amet adipisci ab tempore. Eos neque blanditiis."
WO0221;H008;Colhedora de cana;Valtra;Val-318;Média;Preventiva;Aberta;2024-02-13 19:26;;;3483;Manutenção programada;Sistema hidráulico;3;7,2;3,7;7;23,3;16,1;Fazenda A;Manhã;14366;Dr. Pietro Mendes;
WO0222;T012;Trator;John Deere;Joh-T122;Alta;Preditiva;Concluída;2023-06-03 22:03;2023-06-04 21:04;2023-06-05 04:44;460;Condições ambientais;Pneus/Rodas;4;1;42,9;14;12,9;11,9;Armazém;Noite;11547;Luan Rios;Corrupti suscipit nihil aut explicabo quis rerum tempore. Ipsa quasi maxime ut ex unde hic a.
WO0223;H002;Colhedora de cana;New Holland;New-267;Média;Preventiva;Concluída;2025-07-29 16:27;2025-07-30 13:43;2025-08-02 23:03;4880;Manutenção programada;Sistema hidráulico;3;4,5;21,9;9;11,8;7,3;Armazém;Noite;6114;Kaique da Mata;
WO0224;H006;Colhedora de cana;Valtra;Val-290;Alta;Corretiva;Concluída;2024-03-08 01:15;2024-03-08 18:10;2024-03-11 11:59;3949;Condições ambientais;Sistema hidráulico;4;4,6;7,4;10;14,9;10,3;Armazém;Manhã;29266;Bárbara Montenegro;"Earum tempora saepe excepturi.
Aut praesentium corporis quae debitis tenetur tempora. Libero numquam saepe mollitia non cumque alias. Quas cupiditate ipsa laboriosam praesentium soluta."
WO0225;T013;Trator;Valtra;Val-T107;Baixa;Corretiva;Em Andamento;2026-01-31 23:51;2026-02-01 14:25;;1675;Sobrecarga;Motor;1;7,8;16,8;7;8,6;0,8;Fazenda B;Tarde;1721;Bryan Campos;Earum incidunt excepturi dolore provident molestiae. Maxime aut facere. Consequuntur explicabo error consectetur.
WO0226;T014;Trator;John Deere;Joh-T77;Média;Corretiva;Concluída;2024-08-29 15:04;2024-08-31 05:14;2024-09-04 21:44;6750;Desgaste de peças;Ferramentas de corte;3;1,9;15;14;10,3;8,4;Fazenda A;Tarde;8294;Helena Aparecida;Dolores iste dolores adipisci iste ex. Vel repudiandae dolor voluptas sint. Error expedita voluptate.
WO0227;H006;Colhedora de cana;Valtra;Val-290;Baixa;Preventiva;Aberta;2023-02-08 13:51;;;8349;Manutenção programada;Transmissão;1;10,8;20;8;15,8;5;Fazenda B;Manhã;6987;Eduarda Sampaio;
WO0228;H011;Colhedora de cana;Valtra;Val-331;Alta;Corretiva;Aberta;2025-04-05 12:29;;;849;Falha mecânica;Pneus/Rodas;4;9;11,2;12;13,4;4,4;Fazenda A;Tarde;6202;Vitor Rodrigues;
WO0229;T002;Trator;Case IH;Cas-T79;Alta;Preditiva;Aberta;2024-06-03 00:18;;;9073;Desgaste de peças;Ferramentas de corte;4;0,6;15,9;8;18,4;17,8;Fazenda B;Noite;649;Lucas da Rosa;
WO0230;T002;Trator;Case IH;Cas-T79;Média;Preventiva;Aberta;2025-10-05 05:17;;;1855;Manutenção programada;Ferramentas de corte;3;6,4;23,9;13;18,5;12,1;Fazenda B;Tarde;2021;Arthur Gabriel Sousa;
WO0231;T011;Trator;Case IH;Cas-T147;Média;Preditiva;Aberta;2024-12-14 14:13;;;9890;Sobrecarga;Motor;3;9,7;25,6;14;12;2,3;Fazenda A;Tarde;23935;Pietro Fonseca;Voluptate quaerat dicta molestias non facilis cupiditate. Recusandae cupiditate labore corrupti adipisci quia quas officia. Expedita officia at explicabo tenetur voluptatem assumenda.
WO0232;T010;Trator;Case IH;Cas-T77;Média;Corretiva;Concluída;2025-03-03 07:08;2025-03-05 05:07;2025-03-08 21:38;5311;Sobrecarga;Transmissão;2;15,6;14,2;8;18;2,4;Armazém;Tarde;9154;Ana Carolina da Conceição;
WO0233;H001;Colhedora de cana;Case IH;Cas-500;Alta;Preventiva;Em Andamento;2026-02-02 20:33;2026-02-03 05:11;;2557;Manutenção programada;Pneus/Rodas;4;12;1;12;13,3;1,3;Fazenda A;Manhã;30852;Rhavi da Cunha;Provident laborum ea delectus. Incidunt porro quod maiores vitae quis nobis. Deserunt quidem voluptas provident quas voluptatem voluptatibus.
WO0234;T008;Trator;Case IH;Cas-T163;Baixa;Corretiva;Aberta;2025-07-13 09:55;;;7006;Sobrecarga;Motor;1;15,5;39,8;7;21,8;6,3;Fazenda A;Tarde;1639;Maria Clara Garcia;
WO0235;T009;Trator;Case IH;Cas-T173;Média;Corretiva;Concluída;2025-04-19 23:30;2025-04-20 08:32;2025-04-20 15:18;406;Falha mecânica;Transmissão;3;8,5;47,1;9;13;4,5;Fazenda B;Manhã;4541;Juan da Conceição;
WO0236;H014;Colhedora de cana;AGCO;AGC-449;Alta;Preventiva;Aberta;2023-09-01 07:41;;;8516;Manutenção programada;Sistema hidráulico;4;0,5;35;7;21,5;21;Fazenda B;Noite;27203;Julia Viana;"Eligendi magni voluptatibus eius atque a. In est ullam. Dolor laborum alias.
Harum rem reiciendis amet eum. Molestias ipsum occaecati.
Minima illo in ut. Amet eum dicta recusandae accusantium."
WO0237;T010;Trator;Case IH;Cas-T77;Baixa;Preditiva;Em Andamento;2026-02-11 03:28;2026-02-11 06:16;;2748;Sobrecarga;Motor;1;2,4;2,5;10;22,2;19,8;Armazém;Tarde;4603;Maria Cecília Pacheco;
WO0238;H012;Colhedora de cana;Case IH;Cas-275;Média;Corretiva;Concluída;2025-12-23 10:59;2025-12-23 20:35;2025-12-30 07:21;9286;Erro humano;Sistema elétrico;2;6,3;37;6;9,9;3,6;Fazenda B;Manhã;8258;Gabriel Cardoso;Minus corporis deleniti voluptatem. Consequatur repudiandae exercitationem culpa ex nostrum.
WO0239;T009;Trator;Case IH;Cas-T173;Média;Preventiva;Concluída;2023-12-13 14:15;2023-12-14 01:39;2023-12-15 19:21;2502;Manutenção programada;Sistema hidráulico;3;4,1;32,8;10;8,2;4,1;Fazenda A;Tarde;8754;Catarina Câmara;
WO0240;H001;Colhedora de cana;Case IH;Cas-500;Baixa;Preditiva;Em Andamento;2026-02-07 14:52;2026-02-08 07:52;;1654;Desgaste de peças;Ferramentas de corte;1;5,5;13,8;9;8,8;3,3;Armazém;Manhã;6657;Benjamim Santos;Reprehenderit natus harum laborum nostrum ab perferendis. Quas quod amet eum laborum facere. Hic praesentium nulla soluta.
WO0241;T010;Trator;Case IH;Cas-T77;Alta;Preventiva;Aberta;2024-11-04 16:13;;;7089;Manutenção programada;Ferramentas de corte;4;14,6;40,5;7;18,6;4;Armazém;Noite;19047;Manuela Gomes;
WO0242;T007;Trator;John Deere;Joh-T165;Baixa;Preventiva;Aberta;2024-05-30 05:54;;;2092;Manutenção programada;Transmissão;1;17,4;38,7;14;20,4;3;Armazém;Noite;5548;Laís Silveira;"Praesentium suscipit deleniti occaecati. Deleniti at accusamus dolore cum delectus unde dignissimos.
Amet vero aperiam deleniti. Soluta quod ea illo."
WO0243;T015;Trator;Case IH;Cas-T200;Média;Preventiva;Em Andamento;2026-01-28 04:30;2026-01-28 18:36;;5803;Manutenção programada;Pneus/Rodas;3;0,2;43,2;10;19,4;19,2;Fazenda B;Tarde;6471;Luiz Fernando Montenegro;Beatae alias voluptates rem accusantium provident natus. Architecto ab veniam maiores nemo quo accusantium. Laudantium sit inventore sit aperiam expedita.
WO0244;T005;Trator;New Holland;New-T152;Alta;Preventiva;Concluída;2025-02-19 11:34;2025-02-19 14:43;2025-02-19 20:57;374;Manutenção programada;Motor;4;0,9;6,4;7;19,9;19;Fazenda A;Manhã;20826;Henrique Pimenta;
WO0245;H002;Colhedora de cana;New Holland;New-267;Alta;Preventiva;Em Andamento;2026-01-31 12:16;2026-02-01 10:21;;5192;Manutenção programada;Sistema elétrico;4;9,6;14,3;14;10;0,4;Fazenda B;Tarde;16186;Marcos Vinicius Pacheco;
WO0246;T010;Trator;Case IH;Cas-T77;Alta;Preditiva;Concluída;2024-05-29 15:08;2024-05-31 09:02;2024-06-05 02:34;6812;Condições ambientais;Ferramentas de corte;4;17,4;7,2;6;23,1;5,7;Fazenda B;Noite;10235;Caio Lima;Rem vel aspernatur ea ipsa aspernatur. Illo provident recusandae hic distinctio voluptatem. Animi atque occaecati debitis.
WO0247;T010;Trator;Case IH;Cas-T77;Alta;Preventiva;Em Andamento;2026-02-11 03:21;2026-02-11 21:34;;1576;Manutenção programada;Sistema hidráulico;5;0,9;10;14;15,9;15;Armazém;Noite;14897;Maria Laura Gonçalves;
WO0248;H005;Colhedora de cana;Case IH;Cas-206;Média;Preventiva;Concluída;2025-01-03 07:34;2025-01-05 00:10;2025-01-08 19:45;5495;Manutenção programada;Motor;3;10,2;17;9;15,8;5,6;Fazenda A;Tarde;4821;Felipe da Mota;Quis maxime modi quos neque. Quo earum optio.
WO0249;H007;Colhedora de cana;John Deere;Joh-358;Média;Preventiva;Em Andamento;2026-02-01 01:04;2026-02-01 12:40;;5673;Manutenção programada;Motor;3;6,1;16,3;7;19,8;13,7;Fazenda B;Tarde;26455;Carolina Rodrigues;
WO0250;T015;Trator;Case IH;Cas-T200;Média;Preventiva;Aberta;2025-01-12 16:25;;;2187;Manutenção programada;Ferramentas de corte;2;4;32,8;11;19,7;15,7;Fazenda B;Manhã;4921;Júlia Novais;"Voluptas accusantium minima aspernatur aperiam. Molestias eius tenetur numquam porro nesciunt sunt animi. Eveniet facilis perferendis pariatur doloribus.
Fugit nemo culpa possimus."
WO0251;T001;Trator;New Holland;New-T163;Média;Preditiva;Em Andamento;2026-01-29 20:26;2026-01-30 10:51;;2666;Erro humano;Motor;3;6,7;14,5;16;9,4;2,7;Fazenda A;Manhã;16551;Luiz Otávio Cunha;
WO0252;T007;Trator;John Deere;Joh-T165;Alta;Preditiva;Em Andamento;2026-01-27 07:19;2026-01-27 17:01;;3378;Condições ambientais;Sistema elétrico;4;11,7;36,8;6;21,7;10;Armazém;Tarde;12832;Cauê da Rocha;"Minus distinctio eum ipsa dicta unde. Nesciunt voluptates dignissimos earum suscipit tempore. Perspiciatis laborum iste ut porro perferendis nostrum.
Maiores ipsa facere. Odit sed cumque eveniet."
WO0253;H012;Colhedora de cana;Case IH;Cas-275;Alta;Preventiva;Aberta;2024-09-03 22:21;;;7519;Manutenção programada;Transmissão;5;3;9,4;10;20,1;17,1;Fazenda B;Manhã;24493;Pedro Lucas Lima;
WO0254;H014;Colhedora de cana;AGCO;AGC-449;Média;Preventiva;Aberta;2023-03-28 00:11;;;1177;Manutenção programada;Motor;3;2,1;9,9;6;8,5;6,4;Fazenda A;Tarde;8324;Caroline Cavalcante;"Totam doloribus ex necessitatibus ab id in odit. Neque vero dolor quos sit architecto eos.
Suscipit esse velit natus. Ipsa odio magnam eos praesentium."
WO0255;H012;Colhedora de cana;Case IH;Cas-275;Média;Corretiva;Concluída;2025-10-04 14:30;2025-10-05 18:32;2025-10-06 07:50;798;Sobrecarga;Ferramentas de corte;3;5,4;12,8;15;20,1;14,7;Armazém;Noite;14159;Srta. Juliana Macedo;"At dolore recusandae a ex culpa veniam iure.
Ratione dolorum voluptatibus fugit expedita beatae. Possimus adipisci quas itaque illo. Repellat neque magni nam labore labore."
WO0256;T009;Trator;Case IH;Cas-T173;Baixa;Corretiva;Em Andamento;2026-02-08 06:12;2026-02-09 05:30;;731;Desgaste de peças;Ferramentas de corte;1;3,8;4;11;11,3;7,5;Fazenda A;Manhã;9452;Pietra Cirino;"Harum deserunt fuga quos perferendis quae quo. Fugiat atque rerum ducimus distinctio quisquam.
Eveniet occaecati atque assumenda nisi debitis maiores illum. Ullam reiciendis ipsa eligendi at."
WO0257;T004;Trator;Valtra;Val-T81;Baixa;Preditiva;Em Andamento;2026-02-21 12:26;2026-02-21 23:52;;4645;Condições ambientais;Ferramentas de corte;1;2,9;4,4;16;10,1;7,2;Fazenda A;Tarde;5826;Rebeca Almeida;
WO0258;H009;Colhedora de cana;Valtra;Val-288;Alta;Corretiva;Aberta;2023-11-23 18:59;;;1931;Sobrecarga;Motor;5;14,3;7,3;15;22,8;8,5;Armazém;Tarde;31997;Júlia Fonseca;Beatae aliquid impedit officia eveniet sit autem. Occaecati facilis nostrum fugiat corrupti magni ab. Veniam ut est.
WO0259;H010;Colhedora de cana;AGCO;AGC-327;Média;Preditiva;Aberta;2024-07-21 11:52;;;9163;Erro humano;Transmissão;3;6,4;43,6;13;9,7;3,3;Fazenda A;Tarde;8291;Esther Cirino;
WO0260;T006;Trator;New Holland;New-T150;Alta;Corretiva;Concluída;2024-04-27 07:37;2024-04-27 18:42;2024-04-28 07:40;778;Condições ambientais;Sistema hidráulico;4;13,5;30,3;10;22,4;8,9;Fazenda A;Noite;22249;Calebe Novais;"Dicta est blanditiis laborum consequatur alias corrupti. Velit sit error explicabo repellat quos. Commodi doloremque porro ipsum similique.
Repellendus ipsum nulla quibusdam. Aspernatur at porro."
WO0261;H002;Colhedora de cana;New Holland;New-267;Alta;Preditiva;Em Andamento;2026-01-27 03:26;2026-01-27 11:41;;3592;Falha mecânica;Sistema hidráulico;4;7,4;22,2;11;13,1;5,7;Fazenda A;Tarde;3104;Maria Clara da Mata;
WO0262;H001;Colhedora de cana;Case IH;Cas-500;Alta;Preventiva;Aberta;2023-11-22 19:18;;;1954;Manutenção programada;Ferramentas de corte;5;11,7;37,6;6;20,2;8,5;Fazenda A;Noite;13223;Cecilia Aragão;
WO0263;H003;Colhedora de cana;Valtra;Val-478;Média;Corretiva;Concluída;2023-05-31 16:33;2023-06-02 05:00;2023-06-08 11:20;9020;Falha mecânica;Sistema elétrico;2;5,9;42,9;14;17,7;11,8;Fazenda B;Manhã;5260;Srta. Rafaela Pires;
WO0264;H002;Colhedora de cana;New Holland;New-267;Média;Preditiva;Concluída;2024-02-05 15:13;2024-02-06 21:38;2024-02-11 18:31;7013;Erro humano;Ferramentas de corte;3;4,4;9,3;16;15,9;11,5;Fazenda A;Noite;9282;Rafael Fogaça;Praesentium dolorum quo pariatur totam totam dolore hic. Quod officia nulla fugiat est esse facere. Tempore amet fuga necessitatibus dolorum.
WO0265;T008;Trator;Case IH;Cas-T163;Alta;Corretiva;Em Andamento;2026-01-30 21:44;2026-01-31 04:09;;1008;Desgaste de peças;Motor;5;18,7;19,6;13;22,7;4;Fazenda B;Noite;19451;Dr. João Miguel Silveira;
WO0266;H011;Colhedora de cana;Valtra;Val-331;Alta;Corretiva;Em Andamento;2026-02-09 07:34;2026-02-09 14:29;;2556;Falha mecânica;Sistema elétrico;5;9,7;36,1;8;11,1;1,4;Armazém;Noite;30303;Pietro Marques;"Nostrum sint voluptas nisi reiciendis facere. Saepe autem mollitia explicabo voluptates quo.
Voluptate quibusdam corrupti facere pariatur quas doloribus qui. Repellat rerum commodi tempora unde."
WO0267;H007;Colhedora de cana;John Deere;Joh-358;Alta;Preditiva;Concluída;2025-07-17 13:46;2025-07-18 12:42;2025-07-24 04:01;8119;Erro humano;Ferramentas de corte;4;18,8;42,3;14;20,7;1,9;Armazém;Noite;17697;Stella Nunes;"Commodi iure sequi voluptatibus iure id.
Reiciendis esse nobis non a. Doloribus illo adipisci quisquam asperiores natus. Repudiandae eos consequuntur dolores at tempora quasi."
WO0268;T008;Trator;Case IH;Cas-T163;Baixa;Preditiva;Em Andamento;2026-01-29 03:17;2026-01-29 18:53;;3908;Falha mecânica;Sistema hidráulico;1;4,5;6,9;11;12,6;8,1;Fazenda A;Noite;6792;José Caldeira;
WO0269;H009;Colhedora de cana;Valtra;Val-288;Média;Corretiva;Concluída;2024-03-24 15:48;2024-03-26 11:37;2024-03-27 14:30;1613;Falha mecânica;Sistema elétrico;2;2,8;28,8;16;15,5;12,7;Fazenda A;Noite;12472;Miguel Lopes;
WO0270;T008;Trator;Case IH;Cas-T163;Alta;Preventiva;Em Andamento;2026-02-02 11:03;2026-02-02 22:45;;6314;Manutenção programada;Sistema hidráulico;4;5,2;1,5;13;21,5;16,3;Fazenda B;Noite;13715;Luana Alves;Incidunt error et deserunt at eveniet. Rerum aspernatur at laborum exercitationem atque debitis fugiat. In placeat in dolore.
WO0271;H012;Colhedora de cana;Case IH;Cas-275;Baixa;Preventiva;Aberta;2023-01-06 00:23;;;2294;Manutenção programada;Transmissão;1;6,1;15;13;16;9,9;Armazém;Tarde;4420;João Gabriel das Neves;
WO0272;H010;Colhedora de cana;AGCO;AGC-327;Alta;Preventiva;Em Andamento;2026-02-10 12:04;2026-02-10 14:04;;3409;Manutenção programada;Motor;5;12,5;46,2;13;22;9,5;Fazenda B;Tarde;4401;Agatha da Mota;
WO0273;H006;Colhedora de cana;Valtra;Val-290;Média;Preditiva;Concluída;2024-06-01 17:19;2024-06-02 03:43;2024-06-08 15:47;9364;Erro humano;Transmissão;3;8,5;46,9;7;14,1;5,6;Fazenda B;Noite;29807;Catarina Albuquerque;
WO0274;T004;Trator;Valtra;Val-T81;Alta;Corretiva;Aberta;2026-02-22 11:16;;;1707;Falha mecânica;Transmissão;5;9;17,3;11;12;3;Fazenda B;Tarde;49336;Gabrielly Câmara;"Reiciendis ipsa commodi fugit tempora pariatur. Iure facere magnam nobis corporis.
Illo a ullam veniam ex. Atque sed impedit at dolore aperiam distinctio.
Unde doloremque voluptates debitis saepe."
WO0275;H015;Colhedora de cana;Case IH;Cas-360;Média;Corretiva;Em Andamento;2026-02-13 13:01;2026-02-14 05:59;;2241;Falha mecânica;Sistema elétrico;3;8,8;39,4;6;17,7;8,9;Armazém;Tarde;13996;Josué Brito;
WO0276;T012;Trator;John Deere;Joh-T122;Baixa;Preventiva;Concluída;2023-03-30 17:59;2023-04-01 08:21;2023-04-08 01:57;9696;Manutenção programada;Sistema hidráulico;1;3,9;44,6;15;9,6;5,7;Armazém;Noite;9750;Maria Helena Viana;
WO0277;H004;Colhedora de cana;Valtra;Val-228;Alta;Corretiva;Concluída;2025-08-02 05:31;2025-08-03 18:20;2025-08-08 04:59;6399;Condições ambientais;Sistema hidráulico;4;0,8;15,9;7;10,6;9,8;Fazenda A;Tarde;12896;Yasmin Aparecida;"A non velit non. Possimus vitae atque distinctio. Autem veniam porro natus necessitatibus hic dicta.
Soluta error sint explicabo in incidunt error. Pariatur cumque quis consectetur quas soluta."
WO0278;H006;Colhedora de cana;Valtra;Val-290;Alta;Preditiva;Aberta;2023-02-18 21:22;;;2685;Falha mecânica;Sistema elétrico;5;2,6;29,9;13;8,5;5,9;Fazenda A;Noite;7900;Noah Mendonça;Pariatur nobis quisquam recusandae sint. Modi dolores quaerat dolores esse ullam maiores. Modi fugit nobis quibusdam ratione.
WO0279;T008;Trator;Case IH;Cas-T163;Alta;Preventiva;Em Andamento;2026-02-01 02:22;2026-02-01 11:45;;3139;Manutenção programada;Sistema elétrico;4;15,5;4,6;9;15,8;0,3;Fazenda A;Tarde;23160;Luna Fernandes;
